Topic,URL,Description
Feed with cup,https://rhlaiservice2.blob.core.windows.net/hmbs-enc2/Feed_with_Cup_CB.mp4,"When the small baby is awakening to a feed every two to 4 hours, try feeding him by cup. He is ready to cup feed if he can swallow milk without coughing, choking or turning blue. Help the mother recognize the baby's feeding signals. Eyes open, looking around, moving his mouth and his tongue. Feed the baby whenever he signals his hunger. Teach the mother to cup feed by first showing her the steps, then guiding her as she feeds her baby. Have her wash her hands, then pour the baby's measured volume of milk into a small cup. Next, have the mother wrap her baby and hold him in a nearly upright position on her lap. Her hand supports his head and neck. The mother rests the cup lightly
on the baby's lower lip. She then tips the cup until the milk reaches the top edge and lets the baby take the milk. A small baby needs to pace himself during cup feeding. Here he pauses. Now there's a burst of lapping and then another short pause. Keep the milk right at the rim of the cup and leave the cup in place, resting lightly on the baby's lower lip. Let the baby feed and watch for signs that he's had enough. Notice now the baby holds his hand up and then starts to fall asleep. Feedback and encouragement will help a mother become confident in feeding her baby. In this next example, again the milk is kept level with the rim of the cup, giving the baby a continuous supply of milk. The baby takes the milk at his own pace. To signal he's done the baby closes his mouth.
Related keywords: cup feeding, upright, milk, licking, lapping, pace, pause, mother feeding , signals, milk paladai, spoon, swallow."
Insert NG tube,https://rhlaiservice2.blob.core.windows.net/hmbs-enc2/Insert_a_Nasogastric_Tube_CB_B.mp4,"The tube is passed through the nose, down the back of the throat and into the stomach. Take the time to talk with the mother about the procedure and the need for it. Reassure her that this is safe and will not hurt her baby. To start, gather the nasogastric tube, a 5 milliliter syringe, a feeding syringe, a marker, and a tape. A five or six French gastric tube is best for a small baby. Wash your hands well with soap and water. Next, measure the length of tube to be inserted. It goes from the tip of the nose to the earlobe to a point halfway between the tip of the breastbone and the umbilicus. Now put the end of the tube on the tip of the baby's nose. Stretch it to the earlobe, then to a point halfway between the tip of the breast bone and the umbilicus. Mark the length, lubricate the tip with expressed milk to ease the passage of the tube. Hold the baby's head still and flex his neck forward slightly. Gently insert the tube through the baby's nostril slowly and steadily. Aim to the back of the head until you've reached your mark. The tube is uncomfortable for the baby as it's inserted, but painless once it's in place. Now tape the tube, keeping your mark visible. Never force the tube if it doesn't slide easily, stop and try the other nostril. Very rarely, the tube may try to go into the trachea leading to the lungs. This is rare but serious. A feeding that goes into the lungs can possibly be fatal. Now check for correct placement. Connect the syringe to the tube. Pull back on the syringe and look for small amounts of digested milk or gastric fluid in the tube. If there is no fluid in the tube, remove it and repeat the procedure. Tape the tube securely once you've confirmed that it's in the right place, be sure the tape sticks to the tube to avoid it sliding around beneath the tape. Your mark should be visible near the nose.
Related keywords: nasogastric tube, NG tube, feeding, swallow, small babies, insert, insertion, syringe, infant, nostril, placement, tape, secure feeding tube."
Transition to breastfeeding,https://rhlaiservice2.blob.core.windows.net/hmbs-enc2/Transition_to_Exclusive_Breastfeeding_CB.mp4,"Teach the mother to recognize her baby's feeding signals. At first, the baby may only awaken or stir before feedings. As the baby matures, his feeding signals will become more obvious. Have the mother put her baby to her breast even briefly when he signals his hunger. Show her how to position her baby securely so that his head and body are supported. Teach her to express drops of milk into her baby's mouth. At first, he may only swallow once or twice and then fall asleep. If he chokes or turns blue, he's not yet ready to breastfeed. After practice time at the breast, have the mother give the baby his full volume of milk by cup or feeding tube. At this stage, he'll receive almost all his milk this way and very little from the breast. By getting his feeding needs met so easily, he'll grow faster. As the baby matures he'll stay awake longer at the breast and learn to suckle. Suckling helps develop his feeding skills and stimulates the mother's milk production. Once he suckles well, teach the mother how to attach her baby. Have her rub her nipple on his lips and drip milk into his mouth. Be patient. When he opens wide, have her bring him directly onto her breast. Notice the signs of attachment. His mouth is wide open, his chin touches the breast and his cheeks are rounded. More areola is seen above the baby's mouth than below. His jaw drops as he drinks and he pauses briefly as he swallows. Now he's learned to coordinate sucking, swallowing and breathing to breastfeed effectively. Feeding is hard work for a small baby. Watch for signs that the baby has had enough. He may bat at the breast, pull off, cry or fall asleep. Then let him rest skin to skin between the mother's breasts. As the baby matures, his breastfeeding skills will improve. His sucks will become long, strong and regular and his jaw will drop low as he swallows. The baby will learn to take rest, breaks and pace himself. It's important for the mother to build up a generous supply of milk. The flow of milk will be easier for the small baby to access. After her baby feeds, advise the mother to express her milk to keep her supply up. Her breast should feel soft when she's removed enough milk. Gradually increase breastfeeding with less and less supplementation. As a guide, if the baby does not attach well at the breast, give him a full feed by feeding tube or cup. If he attaches well but has frequent long pauses or feeds for less than ten minutes, give half
the feed by cup or feeding tube. If the baby feeds well by breast for more than 15 minutes, he does not need extra feeding. At this point, the mother can very gradually reduce
the number of times she expresses. Make sure the baby's weight gain continues once he is only breastfeeding, that he is content after feeds, and that he has frequent yellow stools, four or more each day.
Related keywords: transition to breastfeeding, exclusive breastfeeding, feeding, breast, baby feeding readiness, drops of milk, attachment, matures, sliding scale, feeding supplementation, immature feeding, effective feeding, sucking, pacing, paced feeding, cup feeding, tube feeding."
Prepare for discharge,https://rhlaiservice2.blob.core.windows.net/hmbs-enc2/Prepare_for_Discharge_CB.mp4,"First, the baby's general health should be good with no features of serious infection or danger signs. Second, the baby's breathing should be normal with a normal breathing rate, no chest indrawing, and no pauses in his breathing. Third, the baby's temperature should be normal and stable for three days in a row, either while being
held skin to skin or dressed warmly. Fourth, the baby should be feeding well and gaining weight. He should be attaching well at the breast and sucking effectively. Or he may be partially breastfeeding and taking the rest by cup. If the mother is also cup feeding, she should be expressing effectively and have a good supply of milk. If the baby is less than ten days old, his weight should be stable for three days in a row. If he is more than ten days old, his weight should be gradually increasing and fifth, a mother and family
should be confident they can care for their baby. Once you've decided that the baby is ready for discharge, prepare the mother and family to care for their baby at home. Here are five ways. First, keep the baby warm. Advise the family that skin to skin care should be continued until the baby weighs at least two kilos. Second, feed the baby only mother's milk as often as the baby wants, at least every two to 3 hours day and night. Progress to exclusive breastfeeding as the baby's skills and strength improve. Third, give the baby love and attention. Stimulating the baby often by touching and talking to him helps the baby's growth and development. Fourth, prevent infection. Remind the mother and family members to wash their hands with soap and water before touching the baby, every time they clean stools and urine, while feeding the baby and whenever their hands are dirty. Give the baby his first vaccine before he leaves. Fifth, teach the danger signs. Advise the family to bring the baby to a health worker right away, day or night, if any danger signs occur. Fast breathing, chest in drawing - the chest draws in with each breath, a cold body temperature - the baby's belly and feet are cold compared to their own, a hot body temperature - the baby's body is hot to touch, not feeding - the baby doesn't act hungry and may not wake up to feed, no movement - the baby doesn't move when stimulated, convulsions - the baby may have unusual eye or mouth movements or repetitive jerking of the arms or legs. Follow the baby's progress. Give the mother a phone number to call with questions or problems and see the baby twice a week until the baby weighs two kilos and once a week until he weighs two and a half kilos. discharge, weight gain, temperature stable, feeding well, advise, hygiene, teach danger signs, counseling parents, follow up, outpatient, home discharge planning."
Advise about ongoing care,https://rhlaiservice2.blob.core.windows.net/hmbs-enc2/Advise_about_Ongoing_Care_CB.mp4,"After the baby is discharged home, see him twice a week until he reaches two kilos, then once a week until he is two and a half kilos. Bring a weighing scale, soap, a thermometer, a timepiece, danger sign visual aids and the baby's records. First, wash your hands. Remind the family that anyone who touches the baby wash their hands with soap and water first, especially before feeding, after cleaning his stools and whenever their hands are soiled. Find out how the mother and family are doing now that the baby is home. Ask if there is anything about the baby that concerns them. Throughout the visit, teach the family how to care for and protect their young baby. Have them keep the baby warm in continuous skin to skin contact. Teach the mother to check a baby's feet for warmth at each feed. Advise the family to clean the baby with a cloth when needed, but don't chill him with a bath. Encourage family members to have eye contact and to talk to their baby. Love and attention help the baby's emotional and social development. Now decide if the baby is feeding well. Each small baby progresses along his own path to full breastfeeding. Decide at each visit if the baby is feeding well and making progress. The baby is feeding well if he is content between feeds, he is gaining weight and his stools are yellow and frequent, four or more each day. Next, decide if the baby is healthy. As you check the baby, teach the family the seven danger signs. The first thing to do is to go immediately to the health center. A danger sign is practically saying the baby could die at home, so they have to run with any sign of alarm. Decide if the baby is gaining weight. Weigh the baby, then plot the weight on his growth chart. Show the family the baby's progress. After the first week of life, when some weight loss is normal, the baby should gradually gain weight.
Related keywords: home, follow up, outpatient, baby bath, emotional development, social development, weight gain, growth chart, family members, hygiene."
Assess for danger signs,https://rhlaiservice2.blob.core.windows.net/hmbs-enc2/Assess_for_Danger_Signs_CB.mp4,"Poor feeding is the first danger sign. The baby with poor feeding sucks less or poorly, or not at all. He may not open his mouth when offered the breast or he doesn't act hungry. He may not wake up to feed or he does not stay awake long enough to empty the breast. Here we compare a healthy baby. She is alert and suckles well at the breast.
Lethargy is the second danger sign. Observe the baby's movements. A baby with lethargy will have less energy than normal and appear sluggish and drowsy. Try to wake the baby. Clap or rub a foot. Notice that the baby with lethargy doesn't wake up easily. Here we compare a normal sleeping baby. When we try to wake him, even just by clapping, he reacts normally by fussing and crying and then he stays awake. The baby with lethargy only moves when aroused or he doesn't move at all. Lethargy and poor feeding often overlap. Convulsions are the third danger sign. Features of convulsions in a newborn are often subtle such as a staring look, blinking of eyelids and unusual movement of the lips. Convulsions can also be more obvious. In this baby, we see tight flexing of his feet and repetitive jerking of his arm. A cold body temperature is the fourth danger sign. Compare the baby's body temperature to your own. If the baby's feet and belly are cold, the baby is too cold and may be very sick. A thermometer measuring less than
35.5 degrees is dangerously low. Warm the baby quickly through skin to skin contact on the mother's chest and cover them with blankets. If after the baby is warmer, he still
looks unwell, this is a danger sign. A hot body temperature is the fifth danger sign. The baby's body will feel hot to touch compared to your own body. The mother may report that the baby's mouth is hot on her breast. The face and body may look flushed. A temperature more than 37.5 degrees is too high. Cool the baby off by removing his clothes for ten minutes. If the baby is still too hot or looks unwell, this is a danger sign. Chest indrawing is the sixth danger sign. Watch the baby's chest and abdomen closely. Notice as the baby draws a breath, his chest draws in and the belly appears to move out. Fast breathing is the seventh danger sign. To determine if a baby is breathing too fast, count breaths for a full minute when the baby is quiet, more than 60 is too fast. Count again to be sure. Babies with breathing problems can have fast breathing or chest in drawing and often both signs occur together. Here we compare a baby with normal breathing to a baby with both fast breathing and chest in drawing, nasal flaring and grunting, a sound heard on the outer breath can also be present in a baby with severe breathing problems.
Related keywords: danger signs, poor feeding, lethargy, sluggish, drowsy, doesn't wake, convulsions, seizures, jerking movement, cold, fever, chest indrawing, fast breathing, tachypnea, nasal flaring, low temperature, 35.5 degrees, 37.5 degrees, antibiotics."
Give antibiotics,https://rhlaiservice2.blob.core.windows.net/hmbs-enc2/Give_Anitbiotics_CB.mp4,"Wash your hands, then gather your supplies. Gentamycin, ampicillin and sterile water for injection, a sterile syringe and needle for mixing the ampicillin, cotton balls and two smaller sterile needles and syringes to give the injections. Check that the medicines have not expired. Gentamicin is available in several strengths. Be sure to double check the concentration before you draw up the dose. There is no need to dilute any of the products. The 80 milligrams per 2ml concentration is preferred. The smaller volume is less painful for the baby. The dosage chart shows that our 3.2 kilo baby needs 0.4ml of this concentration. A 1ml syringe, will help your accuracy with the small dose. Now draw up the medicine. First, draw air into the syringe equal to the dose you need. Then inject the air into the vial. Turn it upside down, keeping the tip of the needle in the fluid.
If you've drawn bubbles into the syringe, push the plunger back and forth to return them to the vial. Drying up your dose is easy because the air you added to the vial counteracts the vacuum. Now tap the syringe to let any remaining bubbles rise to the top and gently push the plunger to clear them. Check that you have the right dose of 0.4ml. Cap the needle with the one handed method to avoid a finger prick. If you are using an ampule instead of a vial, wrap the neck in gauze to protect your hand and snap off the top. Put the needle carefully into the opening to draw up the medicine. Now prepare ampicillin. Follow the directions on the bottle to prepare the medicine. Draw up 1.8ml of sterile water and add it to the 500 milligrams bottle of ampicillin. Shake the bottle to mix the powder and water until it's completely dissolved. The baby will need 0.6ml ampicillin. Draw 0.6ml of air into the syringe, then inject it into the vial. Turn it upside down, keeping the needle in the fluid. Draw up your dose. Notice the bubbles being returned back to the vial before removing the syringe. Now tap the syringe to clear the remaining bubbles and gently push the plunger to remove the air. There's your dose of 0.6ml. The sick baby needs his first dose of gentamicin. Let the mother know that the medicine will help her baby get well. Show her you'll be giving it in the baby's upper outer thigh, the safest place to give an IM injection in a baby. Show the mother how to hold her baby still. Her arm goes across her baby's upper body holding his arms and her hand holds the baby's leg. Breastfeeding will comfort the baby during the injection. Clean the skin with clean water. Put a second cotton ball close by. Hold the baby's thigh firmly throughout the injection. Then with one quick motion insert the needle at a 90 degree angle straight into the outer thigh muscle. Inject steadily, withdraw the needle and apply gentle pressure with a cotton ball. The needle goes safely into the sharps container.
Related keywords: antibiotics, infection, needle, syringe, ampicillin, gentamycin, vial, treatment, sick, medicine, intramuscular injection, thigh."
Recognize severe jaundice,https://rhlaiservice2.blob.core.windows.net/hmbs-enc2/Recognize_Severe_Jaundice_CB.mp4,"Now check the baby for jaundice. Go outside, you can see the yellow tone best in natural daylight. Jaundice starts in the face and spreads down towards the trunk to the arms and legs and last to the palms and soles. Jaundice reaching the palms and soles is always serious. Jaundice is subtle to see, press the skin firmly to widen it and observe for yellow tinge. You see a faint yellow tinge on the baby's nose, on the arm and the neck but there is no jaundice on the palms or soles. Here we will compare a baby with no jaundice, a baby with mild jaundice. Another baby with mild jaundice and a baby with severe jaundice. Here's a baby's palm without jaundice compared to a palm with jaundice. Here's a baby's sole without jaundice compared to a sole with jaundice.
Related keywords: jaundice, yellow palms, soles, severe, phototherapy, hyperbilirubinemia, bilirubin."
Stabilize for referral ,https://rhlaiservice2.blob.core.windows.net/hmbs-enc2/Stabilize_for_Referral_as_Needed_CB.mp4,"Seek advanced care promptly for babies who weigh less than 1500 grams, those with pauses in their breathing, serious jaundice, cold infection, babies unable to feed well, those with poor weight gain or babies with a danger sign. Explain the need for referral to the family. Its important to gain their confidence. Carefully describe the urgent condition of the baby and that care in a hospital may save the baby's life. Encourage the mother and family members to see and touch their baby. Be patient and sensitive in answering their questions. Develop a referral plan. Here are eight steps. First, have emergency funds available. Second, have reliable transportation ready at all times.
Third, have contact numbers clearly visible for the transport driver and the referral hospital. Fourth, have equipment ready to take that may include a bag, mask, suction and
supplies for a nasogastric tube. Fifth, call to arrange for transport of the baby, mother and a family member. Sixth, send a health worker who can manage problems if they occur. Seven, notify the referral hospital about the baby's condition and eighth, write a referral note. Include your exam findings, the reason for the referral and all treatments given. Include any other important notes such as maternity and newborn records. Stabilize the baby before transport. Give the first doses of antibiotics if there is a danger sign. Give the baby breast milk through a nasogastric tube or IV fluids if he is unable to feed. Help the baby breathe if needed. For example, give oxygen if available. Position the baby skin to skin to keep him warm during the journey. These measures help prevent an unwell baby from becoming worse while being transported.
Related keywords: advanced care, stabilize, refer, referral, emergency, transport, equipment, ambulance, treatment, unwell baby, record."
