Topic,URL,Description
Sore or cracked nipples,https://rhlaiservice2.blob.core.windows.net/hmbs-enc2/Sore_or_Cracked_Nipples_CB.mp4,"Painful nipples are usually caused by a baby who is not well attached at the breast. This can be prevented by early attachment in the first hours after birth. When the baby is given the time to find the breast on her own, this will often result in good attachment. To prevent painful nipples, be sure all mothers in your care can attach their babies well before leaving for home. If nipple pain does start, help the mother as soon as possible. First observe her breastfeeding. Here we see that the baby's mouth is not wide open. She is taking only the nipple. The mother's fingers prevent the baby from taking more breast. The baby slips off the nipple easily and the mother feels pain. Guide the mother to remove her baby from the breast by placing a finger in a corner of the baby's mouth. Notice the shape of the nipple. A nipple that has been pinched against the hard roof of the baby's mouth will appear pointed instead of round. Explain to the mother that the tongue action of the baby rubs on her nipple and pinches it against the hard palate. This leads to sore and damaged nipples. The key to comfortable breastfeeding is for the baby to attach deeply on the breast. Taking a big mouthful of breast positions the nipple further back in the baby's mouth. Here the nipple will be comfortable in contrast to the nipple in a shallow attachment which is pinched against the hard roof of the mouth. The baby will also get plenty of milk. Help the mother to attach her baby more deeply. Have her hold her baby close facing her breast with the baby's body straight. She positions her baby's nose opposite her nipple. The baby will open her mouth when she smells milk. The mother waits patiently until the baby's mouth opens very wide, then moves the baby quickly onto her breast. The mother can gently compress her breast to get the milk flow started. Pulling her baby closer can also deepen the attachment. We see signs of better attachment. The baby's mouth is wide open. We see more of the areola above the baby's mouth than below. The baby's chin is touching the breast and though we cannot see it, her lower lip should be turned outward. Now her nipple is at normal shape compared to her nipple from when her baby was not attached well. Also compare the signs of attachment. Before, her baby's mouth was almost closed. An equal amount of areola was seen above and below the mouth. The baby's chin was just touching the breast and her lower lip was turned inward. Now, her mouth is wide open. More areola is visible above the baby's mouth than below. The baby's chin is deep in the breast. So buried that we cannot see the bottom lip. Though the new positioning may take time to learn, this mother now understands breastfeeding can be comfortable and the key steps to attaching her baby better. In addition to attaching the baby deeply, here are a few other suggestions that can help with nipple pain. The mother can hand express to bring her milk before putting the baby to her breast. She can improve the attachment by pulling the baby in closer with her forearm. Breast compressions help the baby to get more milk faster, which will shorten the feed and last breast milk is healing to the nipples. Let it dry on the nipples after feedings and keep them open to air. Sometimes nipples can be sore due to thrush. Check the baby's mouth for white patches on the inner cheeks and treat both mother and baby if found. If the mother is HIV infected, she should feed only from the healthy breast, not from a nipple that is cracked or bleeding. She can express and discard milk from the damaged breast until the nipple heals. The baby can then take both breasts again. Give the mother support and reassure her that painful nipples heal very quickly. When the baby is attached well. Have her return if the pain continues.
Related keywords: nipple pain, breast pain, poor attachment, poor latch, cracked nipples, sore nipples, breastfeeding, expressed milk, thrush, support."
Mastitis,https://rhlaiservice2.blob.core.windows.net/hmbs-enc2/Mastitis_CB_D.mp4,"If a mother doesn't take care of a blocked duct, it can progress to a breast infection. The lump will become red, hot, swollen and painful and she'll feel ill often with a fever. If she has a very painful swollen lump, it may be an abscess and would need to be drained by a skilled clinician. In caring for a breast infection, be sure the baby is attaching deeply, then follow the four steps suggested for a blocked duct. First, breastfeed frequently, starting on the infected side. The milk is safe for the baby. Second, apply a warm wet cloth. Third, gently compress the breast and last, massage the breast gently. Remember the area is tender to touch. In a breast infection, the milk is not infected, only the breast tissue. Its still good for the baby. She needs to keep the milk flowing in the infected breast by feeding the baby or expressing milk frequently. If the mother is HIV infected though, she should feed only from the healthy breast, not from the infected breast. She can express and discard milk from the infected breast until her fever is gone.
The baby can then take both breasts again. Give the mother an antibiotic such as dicloxacillin. She can take paracetamol for the pain and fever. Advise her to return if there is
no improvement after one day of treatment. If she has a breast infection, she is ill, she shouldn't work. She should stay in bed, drink plenty of fluids and keep her baby with her to feed often.
Related keywords: blocked duct, mastitis, swollen breast, sore breast, redness, infection, breastfeeding, maternal fever, tender breast, antibiotics, bacteria."
Improve supply of milk,https://rhlaiservice2.blob.core.windows.net/hmbs-enc2/Improve_Supply_of_Milk_CB.mp4,"If a mother thinks her baby is not getting enough milk, how can she increase her baby's intake? First improve the attachment. If the baby is attached only on the nipple, the baby gets very little milk; but, when he takes more of the breast in his mouth, milk comes easily. This deep attachment enables the baby to remove more milk from the breast which then stimulates the breast to make more milk enough for the baby's needs. Babies may not be well attached but because the mother makes abundant milk at first, babies may thrive over a few months though. If the baby is not well attached, he won't take all the milk the mother is making and her supply will decrease. Her baby will start to be restless at the breast, pulling or slapping and may reject the breast entirely or feed for very short periods of time because the flow of milk is not meeting his needs. To prevent that, observe the mother breastfeeding and guide her to improve the attachment right from the start when the baby is a newborn. Next, compress the breast. Compressing the breast will improve the flow of milk and keep the baby drinking. If the baby falls asleep quickly at the breast, compressing will start the milk to flow. The baby will start to swallow and wake up. As the milk comes, have the mother press her breast between her thumb and fingers as far back from the nipple as is comfortable. Pressure should be firm but not painful. Suggest she compress while the baby is sucking and rest while the baby is resting. If the baby is drinking well, there is no need to compress. And last, feed the baby often and well. In the early days after birth the baby will be hungry often, at least ten times between one sunrise and the next. A newborns stomach is small and breast milk is quickly digested. Encourage the mother to follow her baby's signals. He is able to tell her what he needs. Holding her baby skin to skin on her chest to start a feeding helps her baby to calm and organize himself. Teach the mother to respond to her baby's hunger signals. Sucking motions of his lips, bringing her hand to his mouth and turning his head from side to side. Encourage her to feed her baby whenever she sees his feeding signals day and night. There is no need to time how long the baby feeds or remember which breast he was last on. Some babies are fast feeders and others are slow. The baby will know when the flow on one breast has slowed and he is ready for the other side. As the flow of milk slows, the baby comes off the breast on his own. The mother holds her baby to her chest. As she patiently waits, her baby starts to signal his hunger. He was interested in going back on the breast twice more, full at last, the baby falls asleep and drops off the breast. At times the baby may suddenly want more milk than before. This is normal. It means the baby is growing and so is his hunger. As the mother follows her baby signals she will feed him more often and naturally increase her supply of milk. Do not give the baby water, sweetened water, tea, honey, breast milk substitutes or anything else. They can fill up the baby so he won't feed as much at the breast. This will reduce the mother's milk supply. They can also give the baby harmful germs and make him sick. Instead follow the baby's signals. Feed the baby often whenever she signals her hunger. After a few days of extra feeding as long as the baby is well attached and the mother is using compressions to make every feed effective, the mothers milk supply will grow to meet the baby's needs.
Related keywords: breastfeeding supply, production, produce milk, improve supply of milk, milk expression, baby hunger, increase production, improve attachment."
Reassess for discharge,https://rhlaiservice2.blob.core.windows.net/hmbs-enc2/Reassess_for_Discharge_CB.mp4,"Reassess for discharge: Check the baby, be sure he appears well, he's breathing easily and is breastfeeding well.
Related keywords: discharge, feeding well, appears well, breathing well, reassess baby, evaluate baby, stable, well."
Immunize,https://rhlaiservice2.blob.core.windows.net/hmbs-enc2/Immunize_Intradermal_Injection _CB.mp4,"Stretch the skin and hold it firmly, lay the needle and syringe almost flat along the baby's arm with the opening in the needle facing up. Insert the tip into the skin, advance it just past the opening of the needle, gently point the needle upward without re-piercing the skin. Now, inject the vaccine slowly and steadily. You can stabilize the needle with your thumb. You will notice that it's hard to push the fluid in, you should see the skin turning white and raising a small bump.
Related keywords: intradermal, immunize, injection, needle, syringe, inject, BCG."
Advise about home care,https://rhlaiservice2.blob.core.windows.net/hmbs-enc2/Advise_about_Home_Care_CB.mp4,"Teach about care of the baby. First, talk about feeding. Show the family the baby's feeding cues, putting his fingers in his mouth and turning his head means he's hungry. Feed the baby whenever he's hungry, as much and as often as he wants, at least every 2 to 3 hours, day and night. Be sure the mother feels comfortable breastfeeding. If the baby is not well attached, show her how to improve the position and attachment of her baby. Advise that she give her baby only her milk for the first six months. No water, sweetened water, tea, honey, formula or anything else. Advise the family not to put anything on the baby's cord and keep it open to air. They should wash their hands before caring for the baby. There is no need to wash the baby every day, but they should keep his face and bottom clean. Talk about keeping the baby warm. Advise the way they dress him in an extra layer of clothing and a covering on his head. Recommend that the baby sleep on his back or his side, not on his belly. Keep the young baby away from smoke. If malaria is common, recommend using an insecticide treated bed net to prevent malaria in both the mother and baby. If the mother has HIV, be sure she gives her baby ARV medicine to protect him from becoming infected. Next, teach newborn danger signs - fast breathing, chest indrawing, the chest draws in with each breath, a cold body temperature the baby's belly and feet are cold compared to their own. A hot body temperature - the baby's body is hot to touch, not feeding the baby doesn't act hungry and may not wake up to feed. Lethargy, the baby only moves when stimulated. Convulsions, the baby may have unusual eye or mouth movements or repetitive jerking of the arms or legs. If any danger sign occurs in the mother or the baby, advise the family to bring them to the health facility right away, day or night. This could save their lives. The mother and baby need check ups and the baby needs vaccines. Recommend that they go to the health center two to three days after the birth, between seven and 14 days and six weeks after birth.
Related keywords: feeding well, feeding, discharge, care at home, advice for home, back to sleep, sleep on back, discharge guidance, discharge advice, advise for care at home, vaccines, counseling parents, danger signs at home, hygiene, prevention, transition home, parents."
Maintain skin-to-skin,https://rhlaiservice2.blob.core.windows.net/hmbs-enc2/Maintain_Skin_to_Skin_CB.mp4,"Dress the baby in only a hat and a diaper. Add a blanket at the baby's back if the environment is cold. Supporting his bottom and head, place the baby facing his mother's chest between her breasts. Turn his head to one side. Place his legs in a frog position below the breast and his arms above the breasts. Now help the mother secure her baby to her chest by wrapping the cloth around her and her baby. Secure the cloth with a safe knot tied under the baby's bottom. This is more comfortable and helps support the baby and prevent slipping. A stretchy band is a good alternative and especially easy to use. Adjust the top edge of the wrap at the baby's ear to support his head well. Then tilt the baby's head up slightly to allow him to breathe freely and look up at the mother. The wrap needs to be tight enough to keep the baby in place, but not too tight. Give the baby room to breathe freely. The wrap should leave the mother with both hands free and allow her to move around easily while carrying her baby's skin to skin.
Related keywords: skin to skin, maintain temperature, maintain skin to skin, small babies, thermal support, chest, secure, warm wrap, comfortable holding, frog legged positioning."
Support breastfeeding,https://rhlaiservice2.blob.core.windows.net/hmbs-enc2/Support_Breastfeeding_CB.mp4,"Teach the mother how to attach her baby, have her rub her nipple on his ribs and drip milk into his mouth. Be patient, when he opens wide have her bring him directly under her breast. Although the baby's mouth is naturally smaller he's still well attached. His mouth is wide open, his chin touches the breast and his cheeks are rounded. More areola is seen above the baby's mouth than below. The baby is drinking well, notice how his jaw drops and has a brief pause as he swallows. He is now able to coordinate suckling, swallowing and breathing. As the baby matures, his sucks will gradually become stronger and more regular, his attachment would be deeper and he will have the stamina for a full feed. The mother may feel him swallowing and her breast may feel softer after he feeds. With her baby held skin to skin, the mother can easily notice and respond to his hunger signals. She simply loosens the wrap and positions her baby near her nipple. She can also express her milk cup feed and tube feed while the baby is held closely.
Related keywords: support breastfeeding, early breastfeeding, mouth, expression, suckling, drip milk, breastmilk, sucking."
Treat risk of infection,https://rhlaiservice2.blob.core.windows.net/hmbs-enc2/Treat_Risk_of_Infection_CB.mp4,"A woman can have a uterine infection when she's still pregnant, during labor or after giving birth. This can lead to sepsis in both the woman and her baby which is a leading cause of death in both. Treat the baby with preventive antibiotics - ampicillin and gentamycin, for at least two days. Assist the baby often over the next two days if there are signs of sepsis, continue the antibiotics and seek advanced care.
Related keywords: infection, antibiotics, risk of infection, sepsis, treatment, advanced care, treatment, maternal, transmission."
Reassess,https://rhlaiservice2.blob.core.windows.net/hmbs-enc2/Reassess_CB.mp4,"Assess the baby morning, afternoon and night. Here are the three steps. First, talk to the mother. Ask her if she has noticed anything about her baby that concerns her. She is the key caretaker and a partner in the care of her baby. Second, examine the baby. Wash your hands, then do a basic exam. As you check the baby teach the mother key observations. Does the baby look well? Observe his activity. A well baby will be alert and active when awake. Show the mother examples of dangerous signs. An unwell baby may be sluggish or have convulsions. How is the baby breathing? A well baby breathes comfortably at a rate between 30 and 60 breaths per minute. An unwell baby may breathe too fast, have long pauses in his breathing, or have chest in drawing and sometimes a grunting sound. Observe the baby's color. A well baby will have pink lips and tongue. An unwell baby may have blue lips and tongue or jaundice, a yellow color on his palms or soles. Check the baby's abdomen. A well baby has a soft belly. If the belly is distended, the baby may have a problem. Check the baby's temperature. Show the mother how to feel the temperature of her baby's foot. If it's cold or hot, check the baby with a thermometer. Then zero the scale, weigh the baby and record it in the baby's chart. Third, evaluate how the baby is feeding. Find out how much milk the baby takes and how often he feeds in 24 hours, whether by breast, cup or feeding tube. Ask about the baby's stools he's feeding well. If the stools are yellow and frequent, four or more each day after the first week of life. Advise the mother that if she has any concerns about her baby, she should notify a health worker right away, day or night. Bring together the mother's observations with your own findings to discover small changes in the baby's condition quickly. Each time you check a baby, decide - is the baby well or is there a concern? Does he need closer attention or is he unwell and needs advanced care? From that decision comes action. Write your findings in the baby's record and communicate with your coworkers to keep all caregivers up to date on the baby's condition.
Related keywords: reassess, check, examine, feeding, well, activity, concerns, maternal concerns, alert, weigh, evaluate, observations, unwell, advanced care, record, communicate, condition."
Continue skin-to-skin,https://rhlaiservice2.blob.core.windows.net/hmbs-enc2/Provide_Continuous_Skin_to_Skin_CB.mp4,"Skin to skin contact should be as continuous as possible day and night, interacting only for changing diapers or attending to a mother's personal needs. She can do her normal activities while maintaining skin to skin contact. Encourage the mother to walk around and get used to holding her baby this way. She should also sleep with her baby in the lap raising her upper body to keep him in a head up position. Mothers will need support to maintain a continuous contact, encourage the family members to help like keeping the baby skin to skin for short breaks. Teach the mother to observe her baby while skin to skin. There are four observations. The first is activity. A well baby is alert and active when awake. Have her notify a health worker if the baby is listless or lethargic or having convulsions. The second observation is breathing. A well baby breathes comfortably. If a baby is breathing fast, has long pauses in his breathing or appears to be struggling have her notify a health worker. Next is color. The baby's lips and tongue should be pink. Have her notify a health worker if her lips and tongue are blue. Last is temperature. Have the mother feel the temperature of her baby's foot. If his foot is cold, have her notify a health worker. A mother will know her baby best and be able to recognize problems right away. Advise her to tell a health worker right away if anything concerns her.
Related keywords: continuous skin to skin, KMC, kangaroo mother care, wrap, secure, safe, thermal support, small babies, mother support, day and night, family members, activities baby."
Improve thermal care,https://rhlaiservice2.blob.core.windows.net/hmbs-enc2/Improve_Thermal_Care_CB.mp4,"Teach the mother to check her baby's temperature at every feeding by feeling his foot. Her baby's feet feels cold, now check his temperature with a thermometer. The baby's temperature is less than 36.5. He's too cold. Remove any wet clothing, put a hat on the baby's head and place him skin to skin with the mother under several blankets. Close windows and doors to warm the room. Feed the baby to increase his energy. After one hour his temperature is 36.8, the baby is now warm.
Related keywords: thermal support, thermal care, improve, cold baby, infant, mother, warmth, warm temperature, room temperature, drafts, windows, improve, hat, blankets, covering."
Express breastmilk,https://rhlaiservice2.blob.core.windows.net/hmbs-enc2/Express_Breastmilk_CB.mp4,"The mother should have clean hands to express her milk and a clean spoon or cup. To help her milk to flow, have the mother stimulate her breasts by gently massaging with light stroking or gentle circular motions around the whole breast. Seeing and hearing her baby also helps the milk flow. Now show her where to position her fingers. Placing a small piece of tape where her thumb and first finger should go will help her fingers find the right place, two finger widths from the nipple on opposite sides of the breast. Show her how to hold her hand in a c position. Then guide her where to place her hand and fingers on her breast. Her thumb is on one side, her first finger is directly opposite with the nipple in the center. Her other fingers support her breast. Placing your hand over hers, lets the mother feel the emotion and is a good way to teach her the technique of expressing. There are three steps - pressing back toward the chest wall, compressing the thumb and fingers together and then releasing. Where a mother places her thumb and fingers and how she presses will make a difference in her success at expressing her milk, especially early on. A look inside the mothers breast will show why. With her thumb and first finger on opposite sides of the breast, she presses back against the lobules to stimulate the milk to release into the ducts, then gently compresses her thumb and fingers together to move the milk into the ducts and releases. Again she presses back into the denser breast tissue, compresses a little tighter as milk flows almost to the areola and releases. She presses back and with a little tighter compression, the first few drops begin to come. Pressing back, compressing the thumb and fingers together and then releasing. Have her alternate breasts back and forth. It's easiest if she uses the right hand to express the right breast and the left hand to express the left. The other hand holds the spoon. The mother should not expect to see hardly any milk at first. She is just stimulating the milk to start to flow. As she repeats the steps, the colostrum starts to come. Have her move her fingers around the breast to clear all segments. This will help the breast to empty. Suggest she stroke her breast now and then to keep the milk flowing. She should express until the drops of milk stop flowing. To establish a good supply of milk, a mother should express every two to 3 hours throughout the day and night. Removing as much milk as she can each time until her breasts feel soft will help to ensure she will have plenty of milk for her baby.
Related keywords: express milk, express breastmilk, manual expression, fingers, massaging, c position, pressing, compressing, release, drops, colostrum, spoon, cup, stimulate, milk flowing, establish milk supply, express mother milk."
Assess feeding tolerance,https://rhlaiservice2.blob.core.windows.net/hmbs-enc2/Assess_Feeding_Intolerance_CB.mp4,"While many small healthy babies spit up a little milk now and then, a small baby with repeated vomiting especially with a green bile color likely has a serious feeding intolerance. The baby may also have a distended abdomen that maybe tender, bloody stools or diarrhea. These babies are having problems and should be referred urgently for advanced care.
Related keywords: feeding intolerance, vomiting, distension, abdomen, bile, bilious, advanced care, spitting up, spit up, referral baby, small babies, necrotizing enterocolitis."
